{
  "schema_version": 2,
  "id": "chatgpt",
  "status": "catalog",
  "name": "ChatGPT",
  "aliases": [
    "chat-gpt"
  ],
  "summary": "Desktop AI assistant by OpenAI.",
  "publisher": {
    "id": "openai",
    "name": "OpenAI"
  },
  "license": "LicenseRef-OpenAI-ChatGPT",
  "categories": [
    "productivity"
  ],
  "tags": [
    "ai",
    "assistant"
  ],
  "links": {
    "homepage": "https://chatgpt.com/"
  },
  "readme": "README.md",
  "icon_fallback": {
    "text": "GPT",
    "background": "#107F65"
  },
  "screenshots": [],
  "distribution": {
    "type": "external-download",
    "url": "https://chatgpt.com/download/",
    "checked_on": "2026-10-27",
    "reason": "Catalog entry only; pinned artifacts, verified checksums, and a supported install recipe are required before PM installation."
  },
  "downloads": [
    {
      "platform": "linux",
      "arch": "arm64",
      "format": "deb",
      "file_url": "https://persistent.oaistatic.com/codex-app-prod/linux/deb/latest/chatgpt_arm64.deb",
      "version_policy": "rolling",
      "source_url": "https://learn.chatgpt.com/docs/linux/linux-app",
      "checked_on": "2026-10-27",
      "verification": "headers-checked",
      "note": "Linux ARM64 upstream Debian package. HTTP HEAD checked only; payload, dependencies, executable paths, and DevOs compatibility remain untested. DevOsPM extracts deb without maintainer scripts or dependency resolution."
    }
  ],
  "compatibility": {
    "note": "Upstream Linux ARM64 file only. Not tested with the DevOs desktop image or DevOsPM relocation, dependency, and launcher behavior.",
    "status": "untested",
    "libc": "glibc",
    "display": "wayland",
    "profile": "devos-desktop-arm64"
  },
  "kind": "app"
}
