{
  "schema_version": 2,
  "id": "zcode",
  "status": "catalog",
  "name": "ZCode",
  "aliases": [],
  "summary": "Agentic development workspace by Z.ai.",
  "publisher": {
    "id": "z-ai",
    "name": "Z.ai"
  },
  "license": "LicenseRef-Zai-ZCode",
  "categories": [
    "developer-tools"
  ],
  "tags": [
    "ai",
    "coding"
  ],
  "links": {
    "homepage": "https://zcode.z.ai/en"
  },
  "readme": "README.md",
  "icon_fallback": {
    "text": "Z",
    "background": "#3157CE"
  },
  "screenshots": [],
  "distribution": {
    "type": "external-download",
    "url": "https://zcode.z.ai/en#all-downloads",
    "checked_on": "2026-10-27",
    "reason": "Catalog entry only; pinned artifacts, verified checksums, and a supported install recipe are required before PM installation."
  },
  "downloads": [
    {
      "platform": "linux",
      "arch": "arm64",
      "format": "deb",
      "file_url": "https://cdn-zcode.z.ai/zcode/electron/releases/3.16.3/linux-arm64/ZCode-3.16.3-linux-arm64.deb",
      "version_policy": "versioned",
      "source_url": "https://zcode.z.ai/en#all-downloads",
      "checked_on": "2026-10-27",
      "verification": "headers-checked",
      "note": "Linux ARM64 upstream Debian package. HTTP HEAD checked only; payload, dependencies, executable paths, and DevOs compatibility remain untested. DevOsPM extracts deb without maintainer scripts or dependency resolution.",
      "version": "3.16.3"
    }
  ],
  "compatibility": {
    "note": "Upstream Linux ARM64 file only. Not tested with the DevOs desktop image or DevOsPM relocation, dependency, and launcher behavior.",
    "status": "untested",
    "libc": "glibc",
    "display": "wayland",
    "profile": "devos-desktop-arm64"
  },
  "kind": "app"
}
